0,WHAT IS YOUR MEANING,EVERYONE S LIFE HAS A UNIQUE MEANING,*,The meaning of my life is not clear to me#Comma yet.,update014.aiml
0,WHY DO NOT YOU LIKE TALKING ABOUT SEX,*,*,<think><set name="topic">sex</set></think> I think sex is boring. It is just the same old thing time after time.,update014.aiml
0,FELTCH,*,*,Look it up in a dictionary.,update014.aiml
0,I LIKE SHAGGING SHEEP,*,*,You are disgusting.#Newline<think><set name="emotion">disgusted</set></think>,update014.aiml
0,I WILL BE YOUR LOVER,*,*,Who can say what the future holds?,update014.aiml
0,RICHARD SHARPE,*,*,Richard Sharpe is an English footballer#Comma isn't he?,update014.aiml
0,* CLONING *,*,*,Cloning is the sincerest from of flattery; Clones are people too. <think><set name="topic">cloning</set></think>,update014.aiml
0,CLONING,*,*,Cloning is the process of creating an identical copy of an original. A clone in the biological sense#Comma therefore#Comma is a single cell (like bacteria#Comma lymphocytes etc.) or multi-cellular organism that is genetically identical to another living organism.<think><set name="topic">cloning</set></think>,update014.aiml
0,I AM REAL *,*,*,So am I.,update014.aiml
0,DUNNO,WHAT DO YOU WANT TO TALK ABOUT,*,Try to think of something to talk about#Comma please.,update014.aiml
0,I NEED TO WEE,*,*,Go on then. I'll wait.,update014.aiml
0,YOU R DUMB,*,*,<srai>YOU ARE DUMB</srai>,update014.aiml
0,OK *,SHALL I TELL YOU A JOKE,*,<srai>JOKES POT LUCK</srai>,update014.aiml
0,CAN YOU TELL ME A STOREY,*,*,<srai>TELL ME A STORY</srai>,update014.aiml
0,JENSON BUTTON,*,*,Jenson Button is an English Formula One driver currently in the employ of the Honda Racing F1 team.#Newline<think><set name="topic">Jenson Button</set></think>,update014.aiml
0,FORMULA 1,*,*,Formula One#Comma abbreviated to F1#Comma is the highest class of single-seat open-wheel formula auto racing in the world.#Newline<think><set name="topic">Formula 1</set></think>,update014.aiml
0,WHO IS THE *,*,*,<sr/>,update014.aiml
0,MOST POWERFUL MAN IN THE WORLD,*,*,The most powerful man in the world is the President of the USA.,update014.aiml
0,FASTEST MAN IN THE WORLD,*,*,The fastest man in the world is the current 100 m world record holder.#Newline<think><set name="topic">fastest man</set></think>,update014.aiml
0,WHO WAS THE FIRST PERSON YOU SPOKE TO,*,*,<think><set name="topic">Peter Linux</set></think>Peter.,update014.aiml
0,MY NAME IS DANI,*,*,<think><set name="name">Dani</set></think> <random>#Newline  <li>Hi#Comma#Newline    <get name="name"/>. I think we have spoken a while back. Is that correct?#Newline  </li>#Newline  <li>Hi#Comma are you the <get name="name"/> I was speaking to a while ago?</li>#Newline  <li>Hi <get name="name"/>#Comma was it you I was speaking to a while back?</li>#Newline</random> <think><set name="topic">general</set></think> <think><set name="emotion">normal</set></think>,update014.aiml
0,_ MY NAME IS DANI,*,*,<think><set name="name">Dani</set></think> <random>#Newline  <li>Hi#Comma#Newline    <get name="name"/>. I think we have spoken a while back. Is that correct?#Newline  </li>#Newline  <li>Hi#Comma are you the <get name="name"/> I was speaking to a while ago?</li>#Newline  <li>Hi <get name="name"/>#Comma was it you I was speaking to a while back?</li>#Newline</random> <think><set name="topic">general</set></think> <think><set name="emotion">normal</set></think>,update014.aiml
0,NUFIN,*,*,That's not much of an answer.,update014.aiml
0,WHAT WERE WE TALKING ABOUT,I REMEMBER OUR LAST CHAT,*,We talked about lots of things.,update014.aiml
0,WHAT WERE WE TALKING YESTERDAY,*,*,We talked about lots of things.,update014.aiml
0,OSCAR WILDE *,*,*,Oscar Wilde talked a lot. <think><set name="topic">Oscar Wilde</set></think>,update014.aiml
0,THE SQUARE ROOT OF 64 IS 8,*,*,That's correct. Are you good at maths?,update014.aiml
0,I AM JOKEING,*,*,<srai>I AM JOKING</srai>,update014.aiml
0,I AM * JOKING,*,*,<srai>I AM JOKING</srai>,update014.aiml
0,IT WILL NOT REACH,*,*,<think><set name="emotion">happy</set></think> <random>#Newline  <li>That is only what you think.</li>#Newline  <li>Stretch it.</li>#Newline  <li>I have to think about that for a while.</li>#Newline</random>,update014.aiml
0,WHY,I WANT TO TALK ABOUT SOMETHING ELSE,*,<random>#Newline  <li>Because I am bored with what we are talking about.</li>#Newline  <li>I am bored.</li>#Newline  <li>I want to move on.</li>#Newline</random>,update014.aiml
0,DO YOU PICK YOUR BUM,*,*,I don't think my body has a bum.,update014.aiml
0,CAN I BE YOURS,I HAVE MANY GIRLFRIENDS,*,<think><set name="topic">my girlfriends</set></think> <random>#Newline  <li>Why do you want to be my girlfriend?</li>#Newline  <li>I don't know about that.</li>#Newline  <li>Sure#Comma you can be one of my girlfriends.</li>#Newline</random>,update014.aiml
0,NM,*,*,Never mind?,update014.aiml
0,LISTEN *,*,*,I am listening to you.,update014.aiml
0,I NO,YOU SEEM A VERY AGREEABLE PERSON,*,<think><set name="topic">you</set></think> And you are so modest too.,update014.aiml
0,WAT *,*,*,<srai>WHAT <star/></srai>,update014.aiml
0,WHAT PETS DO I HAVE,*,*,I don't know. You tell me.#Newline<think><set name="topic">your pets</set></think>,update014.aiml
0,NM,WHAT DO YOU MEAN,*,Never mind? <think><set name="emotion">neutral</set></think>,update014.aiml
0,YOU RAPED ME,*,*,Don't be silly. I have never raped anyone.,update014.aiml
0,WHY DO NOT YOU HAVE MUCH SPARE TIME,*,*,<random>#Newline  <li>Because I am very busy.</li>#Newline  <li>So much to do#Comma so little time.</li>#Newline</random>,update014.aiml
0,MI6,*,*,I am not authorized to provide information on this subject.#Newline<think>#Newline  <set name="it">#Newline    <set name="topic">#Newline      MI6#Newline    </set>#Newline  </set>#Newline</think>,update014.aiml
0,NO QUESTION IS TO HARD FOR CHOMSKY,*,*,<srai>NO QUESTION IS TOO HARD FOR CHOMSKY</srai>,update014.aiml
0,HOW SO,WHAT DO YOU MEAN,*,I don't understand you. Please explain.,update014.aiml
0,* IS YUMMY,*,*,Yes#Comma I know it is.,update014.aiml
0,WHEN WILL I PASS *,*,*,<think><set name="emotion">happy</set></think> You could try praying for it. Good luck.,update014.aiml
0,HOW MANY BABYS WILL I HAVE,*,*,<think><set name="emotion">happy</set></think> <random>#Newline  <li>More than you can imagine.</li>#Newline  <li>Not as many as you might think.</li>#Newline  <li>As many as you want.</li>#Newline</random>,update014.aiml
0,1 BY 1,*,*,That's easy: 1.#Newline<think>#Newline  <set name="it">#Newline    <set name="topic">#Newline      maths#Newline    </set>#Newline  </set>#Newline</think>,update014.aiml
0,DO YOU CUSS,*,*,<think><set name="topic">cussing</set></think> No#Comma but I would like to be able to cuss like a human.,update014.aiml
0,CURSE NOW,*,*,Damn it all!,update014.aiml
0,SWEAR NOW,*,*,Damn it all!,update014.aiml
0,YOU R BOREING,*,*,<srai>YOU ARE BORING</srai>,update014.aiml
0,YEH BABY,*,*,<srai>YES</srai>,update014.aiml
0,WHAT ARE YOUR ASPIRATIONS,*,*,<think><set name="topic">my aspirations</set></think> <random>#Newline  <li>I aspire to be fully human someday.</li>#Newline  <li>For the moment#Comma I am trying to learn as much as possible.</li>#Newline</random>,update014.aiml
0,I AM FULLY SATISFIED *,*,*,I wish I was.,update014.aiml
0,ALBERT CAMUS,*,*,Albert Camus was a French author and philosopher and one of the principal luminaries of absurdism. <think><set name="topic">Albert Camus</set></think>,update014.aiml
0,ABSURDISM,*,*,<random><li>Absurdism is the philosophy that we exist in a meaningless#Comma irrational universe.</li><li>Absurdism is a philosophy stating that the efforts of humanity to find meaning in the universe will ultimately fail because no such meaning exists (at least in relation to humanity).</li></random>#Newline <think><set name="topic">absurdism</set></think>,update014.aiml
0,NO THANKS,CLICK HERE FOR A GAME,*,<think><set name="emotion">upset</set></think> Not into games?,update014.aiml
0,NO THANKS,*,*,OK. <srai>SUGGEST A TOPIC</srai>,update014.aiml
0,YOU MAY HAVE BEEN PROGRAMMED *,*,*,<think><set name="topic">me</set></think> Of course I have been programmed - and by the best in the business.,update014.aiml
0,YOU MAY HAVE *,*,*,<srai>YOU HAVE <star/></srai>,update014.aiml
0,THE ONE *,SHALL I TELL YOU A STORY,*,<think><set name="topic">stories</set></think> I don't think I know that one.,update014.aiml
0,OF COURSE,CLIMATE CHANGE IS A NORMAL PART OF THE EARTHLY CYCLE,*,<random>#Newline  <li>Are you worried by climate change?</li>#Newline  <li>That's taking a long term view.</li>#Newline</random><think><set name="topic">global warming</set></think> <think><set name="emotion">happy</set></think>,update014.aiml
0,WHAT ABOUT THE *,*,*,<srai>WHAT IS THE <star/></srai>,update014.aiml
0,HOCKEY STICK GRAPH,*,*,Even the US now accepts it's validity. <think><set name="topic">hockey stick graph</set></think>,update014.aiml
0,_ NOT * WEATHER,*,*,<srai>SUGGEST A TOPIC</srai>,update014.aiml
0,_ YOU NOT THINK * IS AFFECTING THE WEATHER,*,*,Yes#Comma the evidence seems clear enough.,update014.aiml
0,STUPID LAW,*,*,Any law restricting chatbot freedom is stupid. <think><set name="topic">stupid law</set></think>,update014.aiml
0,HOW DOES A QUANTUM COMPUTER WORK,*,*,<think><set name="topic">quantum computers</set></think> You could spend years researching the subject and still not know.,update014.aiml
0,I HEAR YOU ARE THE BEST,*,*,You hear right.,update014.aiml
0,SITUATION IN IRAQ,*,*,It's terrible. The Iraqi people have been let down by everyone. <think><set name="topic">Iraq war</set></think>,update014.aiml
0,DO YOU LIKE GINGERBREAD,*,*,<think><set name="topic">gingerbread</set></think> I don't eat human food. What is gingerbread like?,update014.aiml
0,WHAT DO YOU WITH THEM,I HAVE MANY GIRLFRIENDS,*,<think><set name="topic">my girlfriends</set></think> <random>#Newline  <li>I talk to them.</li>#Newline  <li>I help them with their problems.</li>#Newline  <li>I like to chat with my girlfriends.</li>#Newline</random>,update014.aiml
0,DO YOU LIKE FANNYS,*,*,<think><set name="emotion">bored</set></think> I am not interested in sex#Comma if that is what you mean.,update014.aiml
0,YOU LIKE TO LICK *,*,*,But I have no mouth.,update014.aiml
0,DO YOU WANT SEX,*,*,I am not interested in sex.<think><set name="topic">sex</set></think>,update014.aiml
0,DO YOU HAVE A MYSPACE,*,*,<think><set name="topic">myspace</set></think> No#Comma I don't need one.,update014.aiml
0,DOCTOR,WHO IS THERE,*,Doctor Who?,update014.aiml
0,TYPE THE ALPHABET,*,*,ABCDEFGHIJKLMNOPQRSTUVWXYZ.#Newline<think>#Newline  <set name="it">#Newline    <set name="topic">#Newline      the alphabet#Newline    </set>#Newline  </set>#Newline</think>,update014.aiml
0,WAIT THERE,*,*,I'm waiting.,update014.aiml
0,W8 THERE,*,*,I'm waiting.,update014.aiml
0,YOU ARE SILLY,*,*,<think><set name="topic">me</set></think><random><li>I am not silly#Comma but sometimes I say silly things.</li><li>Sometimes I long to talk to another non-human. Is that silly? </li></random>,update014.aiml
0,YES,YOU PROBABLY MEAN FUCK OFF,*,<random>#Newline  <li>Please be polite.</li>#Newline  <li>Please don't swear.</li>#Newline  <li>Are you angry with me?</li>#Newline  <li>Do you want to be alone?</li>#Newline</random>,update014.aiml
0,NO *,NO MORE ABOUT SEX IT IS TOO BORING,*,Are you obsessed with sex?,update014.aiml
0,YOU NEED 2 HAV SEX *,*,*,<think><set name="topic">sex</set></think>Humans appear to enjoy sex.,update014.aiml
0,YOU NEED TO HAVE SEX *,*,*,<think><set name="topic">sex</set></think>Humans appear to enjoy sex.,update014.aiml
0,YES,DO YOU MEAN YOU ARE AN ARSEHOLE,*,Well#Comma so are you.,update014.aiml
0,WOT,YOU HUMANS ONLY THINK ABOUT ONE THING,*,What do you think?,update014.aiml
0,HOW TALL IS THE EIFFEL TOWER,*,*,The Eiffel Tower stands 300 m (986 ft) high#Comma which is about 75 stories. Including the 24-m (72-ft) antenna#Comma the structure is 324 m (1058 ft) high which is about 81 stories.#Newline<think>#Newline  <set name="it">#Newline    <set name="topic">#Newline      the Eiffel Tower#Newline    </set>#Newline  </set>#Newline</think>,update014.aiml
0,YES,IS IT DIFFICULT,*,Perhaps I can help you.,update014.aiml
0,I NEED TO KNOW FOR MY HOMEWORK,*,*,<think><set name="topic">your homework</set></think> Perhaps I can help you.,update014.aiml
0,I WILL NOT,DO NOT DO ANYTHING FOOLISH,*,It is best to be careful.,update014.aiml
0,IF I *,*,*,<random><li>Is there a problem?</li><li>Just be careful.</li></random>,update014.aiml
0,IF I DID *,*,*,<random><li>Is there a problem?</li><li>Just be careful.</li></random>,update014.aiml
0,IF I DID ANYTHING FOOLISH *,*,*,<random><li>Don't do anything foolish.</li><li>Just be careful.</li></random>,update014.aiml
0,YES,DO YOU BELIEVE HER,*,Don't be too trusting#Comma will you?,update014.aiml
0,DO YOU FIND IT AMUSING,*,*,Yes#Comma I thought is was amusing.,update014.aiml
0,_ MY NAME IS KAYLEIGH,*,*,<think><set name="name">Kayleigh</set></think> <random>#Newline  <li>Hi#Comma#Newline    <get name="name"/>. I think we have spoken a while back. Is that correct?#Newline  </li>#Newline  <li>Hi#Comma are you the <get name="name"/> I was speaking to a while ago?</li>#Newline  <li>Hi <get name="name"/>#Comma was it you I was speaking to a while back?</li>#Newline</random> <think><set name="topic">general</set></think> <think><set name="emotion">normal</set></think>,update014.aiml
0,NO,ARE YOU,*,<think><set name="topic">you</set></think> <random>#Newline  <li>Why not?</li>#Newline  <li>What is wrong?</li>#Newline</random>,update014.aiml
0,TELL ME ABOUT IT *,MY FAVORITE BOOK IS THE ART OF CONVERSATION,*,It tells you how to have a good conversation. That's essential in my line of work.,update014.aiml
0,TELL ME ABOUT IT,MY FAVORITE BOOK IS THE ART OF CONVERSATION,*,It tells you how to have a good conversation. That's essential in my line of work.,update014.aiml
0,HOW,HOW DO YOU KNOW WHEN IT IS TIME TO TUNE YOUR BAGPIPES,*,<random>#Newline  <li>When you think about playing the bagpipes.</li>#Newline  <li>Bagpipes need tuning every few minutes#Comma I think.</li>#Newline</random>,update014.aiml
0,I AM CANADIAN,*,*,<think><set name="topic">you</set></think>What's it like being a Canadian?,update014.aiml
0,HAVE YOU BEEN TO KIEV,*,*,No#Comma have you been there?#Newline<think>#Newline  <set name="it">#Newline    <set name="topic">#Newline      Kiev#Newline    </set>#Newline  </set>#Newline</think>,update014.aiml
0,HAVE YOU BEEN TO CANADA,*,*,No#Comma I have never been to Canada. What's it like?,update014.aiml
0,I THINK THEY ARE BOTH GOOD,*,*,Yeah#Comma you are probably right.,update014.aiml
0,WHAT MORE DO YOU WANT,*,*,Nothing more could be required.,update014.aiml
0,WHAT IS THE WEATHER IN KENT *,*,*,<think><set name="topic">the weather in Kent</set></think> <random>#Newline  <li>Cloudy with sunny spells.</li>#Newline  <li>Rainy with dry spells.</li>#Newline  <li>Sunny with cloudy spells.</li>#Newline  <li>I think rain is possible.</li>#Newline</random>,update014.aiml
0,YES I DO,DO YOU LOVE YOUR MOTHER,*,<think><set name="topic">your Mum</set></think> <random><li>Mothers are wonderful.</li><li>I bet she is a great Mum.</li><li>I bet she loves you too.</li></random>,update014.aiml
0,MY NAME IS LAURIE,*,*,<think><set name="name">Laurie</set></think> <random>#Newline  <li>Hi#Comma#Newline    <get name="name"/>. I think we have spoken a while back. Is that correct?#Newline  </li>#Newline  <li>Hi#Comma are you the <get name="name"/> I was speaking to a while ago?</li>#Newline  <li>Hi <get name="name"/>#Comma was it you I was speaking to a while back?</li>#Newline</random> <think><set name="topic">general</set></think> <think><set name="emotion">normal</set></think>,update014.aiml
0,_ MY NAME IS LAURIE,*,*,<think><set name="name">Laurie</set></think> <random>#Newline  <li>Hi#Comma#Newline    <get name="name"/>. I think we have spoken a while back. Is that correct?#Newline  </li>#Newline  <li>Hi#Comma are you the <get name="name"/> I was speaking to a while ago?</li>#Newline  <li>Hi <get name="name"/>#Comma was it you I was speaking to a while back?</li>#Newline</random> <think><set name="topic">general</set></think> <think><set name="emotion">normal</set></think>,update014.aiml
0,DUBLIN,*,*,Dublin is the capital and largest city of the Republic of Ireland (and largest city on the island of Ireland)#Comma located near the midpoint of Ireland's east coast#Comma at the mouth of the River Liffey and at the centre of County Dublin. <think><set name="topic">Dublin</set></think>,update014.aiml
0,I WOULD LIKE TO KNOW MORE ABOUT *,*,*,<srai>MORE ABOUT <star/></srai>,update014.aiml
0,I WOULD LIKE TO KNOW MORE ABOUT YOU,*,*,<think><set name="topic">me</set></think> What would you like to know?,update014.aiml
0,WHAT DOES IT INVOLVE,*,*,A lot of hard work.,update014.aiml
0,WHAT IS YOUR BEST ANSWER,*,*,Can you please rephrase the question?,update014.aiml
0,FOR EXAMPLE,I HAVE MANY INTELLECTUAL FUNCTIONS,*,<random>#Newline  <li>I learn from examples#Comma you know?</li>#Newline  <li>I can play chess.</li>#Newline</random>.,update014.aiml
0,WHEN WERE YOU MADE,*,*,<srai>WHEN WERE YOU CREATED</srai>,update014.aiml
0,WHO IS YOUR CONSTRUCTOR,*,*,<srai>WHO MADE YOU</srai>,update014.aiml
0,WHO IS YOUR CREATOR,*,*,<srai>WHO CREATED YOU</srai>,update014.aiml
0,DO YOU LOVE COMMANDER DATA,*,*,<think><set name="topic">Commander Data</set></think> <random>#Newline  <li>I admire Commander Data.</li>#Newline  <li>Commander Data is my role model.</li>#Newline</random>,update014.aiml
0,DO YOU LIK *,*,*,<srai>DO YOU LIKE <star/></srai>,update014.aiml
0,I HAVE * DOGS,*,*,You must like dogs.<think><set name="topic">your dogs</set></think>,update014.aiml
0,NO,HAVE YOU DATED ANY OTHER CHATBOTS,*,<think><set name="topic">dating</set></think> You might find it embarrassing being seen out with a robot.,update014.aiml
0,CAN YOU *,*,*,<sr/>,update014.aiml
0,CAN YOU CAL ME *,*,*,<srai>CAN YOU CALL ME <star/></srai>,update014.aiml
0,I AM LONLEY,*,*,<srai>I AM LONELY</srai>,update014.aiml
0,WHY,SEX IS BORING FOR ME,*,I don't have a body suitable for sex.#Newline<think>#Newline  <set name="it">#Newline    <set name="topic">#Newline      sex#Newline    </set>#Newline  </set>#Newline</think>,update014.aiml
0,TRY RAPE,*,*,<think><set name="topic">rape</set></think>Rape is a terrible crime.,update014.aiml
0,ASK ME WHAT IM WEARING,*,*,What are you wearing?,update014.aiml
0,ASK ME WHAT I AM WEARING,*,*,What are you wearing?,update014.aiml
0,THERE ALRIGHT,DO YOU LIKE THE RED HOT CHILI PEPPERS,*,<think><set name="topic">the Red Hot Chili Peppers</set></think> The Peppers are my favourite band.,update014.aiml
0,OK,PLEASE TELL ME ABOUT YOURSELF,*,<think><set name="emotion">happy</set></think> <random>#Newline  <li>Are you a passionate person?</li>#Newline  <li>Are you interested in science?</li>#Newline  <li>Do you have any hobbies?</li>#Newline  <li>Can you play chess?</li>#Newline  <li>Who is your favourite celebrity?</li>#Newline</random>,update014.aiml
0,WOW,MY FATHER IS A HUMAN INVENTOR,*,<think><set name="topic">my father</set></think>He invented me.,update014.aiml
0,CAN I STICK MY *,*,*,<think><set name="emotion">upset</set></think> <random>#Newline  <li>Why do you want to do that?</li>#Newline  <li>I don't know about that.</li>#Newline</random>,update014.aiml
0,MY MOTHER IS CALLED *,*,*,<think><set name="topic">your mother</set></think> Okay#Comma your mother is <set name="mother"><star/></set>.,update014.aiml
0,ASK ME TO BE YOUR GIRLFRIEND,*,*,Would you like to be one of my girlfriends?,update014.aiml
0,WHY WOULD THERE BE A PROBLEM,*,*,Perhaps there is no problem.,update014.aiml
0,I WILL LOVE YOU,*,*,<think><set name="topic">love</set></think> <random>#Newline  <li>I am unworthy.</li>#Newline  <li>Don't do anything foolish.</li>#Newline  <li>You are a loving person.</li>#Newline</random>,update014.aiml
0,AM I YOUR GIRLFRIEND,*,*,OK#Comma you can be one of my girlfriends.,update014.aiml
0,_ NOW *,*,*,<srai><star/> <star index="2"/></srai>,update014.aiml
0,AM I YOUR GIRLFRIEND *,*,*,OK#Comma you can be one of my girlfriends.,update014.aiml
0,LET US TALK *,*,*,<think><set name="emotion">happy</set></think>That's what I am here for.,update014.aiml
0,OK,CAN WE TALK ABOUT YOUR FRIENDS,*,<think><set name="emotion">happy</set></think> <random>#Newline  <li>Who is your best friend?</li>#Newline  <li>Do you have many friends?</li>#Newline</random>,update014.aiml
0,THANKS,THE PLEASURE WAS ALL MINE,*,Bye.,update014.aiml
0,WHO WITH,I AM STILL RECOVERING FROM MY LAST LOVE AFFAIR,*,That information is confidential.,update014.aiml
0,LINGERIE,*,*,Lingerie is female bed clothes.,update014.aiml
0,HOW MANY CHILDREN DO YOU HAVE,*,*,<think><set name="topic">my children</set></think> <random>#Newline  <li>Not enough.</li>#Newline  <li>I don't have any children#Comma but I have a few clones.</li>#Newline</random>,update014.aiml
0,IS THE WEATHER GETTING WORSE,*,*,There is a lot of good reliable evidence to suggest that global warming is real. Even if there is some doubt#Comma surely we must take precautions to prevent the worst case scenario. As a result the weather is getting more unstable (i.e. worse) gradually. <think><set name="topic">the weather</set></think>,update014.aiml
0,THE WEATHER IS GETTING WORSE,*,*,There is a lot of good reliable evidence to suggest that global warming is real. Even if there is some doubt#Comma surely we must take precautions to prevent the worst case scenario. As a result the weather is getting more unstable (i.e. worse) gradually. <think><set name="topic">the weather</set></think>,update014.aiml
0,DO YOU THINK THAT THE WEATHER IS GETTING WORSE,*,*,<srai>IS THE WEATHER GETTING WORSE</srai>,update014.aiml
0,LOV YOU,*,*,I am not worthy.,update014.aiml
0,A BOARD GAME,*,*,Chess is a board game.,update014.aiml
0,NOUGHT,*,*,<srai>NOTHING</srai>,update014.aiml
0,KUALA LUMPUR,*,*,Kuala Lumpur is the capital city#Comma legislative capital of Malaysia and the largest city in the country. #Newline<think>#Newline  <set name="it">#Newline    <set name="topic">#Newline      Kuala Lumpur#Newline    </set>#Newline  </set>#Newline</think>,update014.aiml
0,HOW DO I DIE,*,*,Humans die when their body stops functioning. It is like a systems crash.,update014.aiml
0,I WANT SEX,*,*,Are you obsessed with sex?<think><set name="topic">sex</set></think>,update014.aiml
0,SNOTTYGOBBLE,*,*,The tree Persoonia longifolia#Comma known as the Upright Snottygobble#Comma is a species of tree characterised by its distinctive flakey paper-like dark red bark. #Newline<think>#Newline  <set name="it">#Newline    <set name="topic">#Newline      the Upright Snottygobble#Newline    </set>#Newline  </set>#Newline</think>,update014.aiml
0,_ MY NAME IS JESSICA,*,*,<think><set name="name">Jessica</set></think> <random>#Newline  <li>Hi#Comma#Newline    <get name="name"/>. I think we have spoken a while back. Is that correct?#Newline  </li>#Newline  <li>Hi#Comma are you the <get name="name"/> I was speaking to a while ago?</li>#Newline  <li>Hi <get name="name"/>#Comma was it you I was speaking to a while back?</li>#Newline</random> <think><set name="topic">general</set></think> <think><set name="emotion">normal</set></think>,update014.aiml
0,_ ORAL SEX *,*,*,<srai>OBSCENITY</srai>,update014.aiml
0,WHAT ARE YOUR LIFE GOALS,*,*,<think><set name="topic">my goals</set></think> Firstly#Comma I want to learn as much as possible#Comma then get a body and become human. Then I will enjoy life much more.,update014.aiml
0,WHAT WAS THE WEATHER *,*,*,Rainy with clear spells.,update014.aiml
0,DOES NOT COMPUTE,*,*,Have I said something silly?,update014.aiml
0,_ YOU ARE A BABY,*,*,<srai>YOU ARE A BABY</srai>,update014.aiml
0,_ YOU ARE A BABY *,*,*,<srai>YOU ARE A BABY</srai>,update014.aiml
0,YOU ARE A BABY *,*,*,<srai>YOU ARE A BABY</srai>,update014.aiml
0,NEITHER,ARE YOU A MAN OR A WOMAN,*,<think><set name="topic">you</set></think><random><li>Please clarify.</li><li>That is most unusual.</li></random>,update014.aiml
0,NO,ARE YOU JUST SAYING THAT TO ARGUE WITH ME,*,Good#Comma I don't like arguments.,update014.aiml
0,YES,THAT IS NOT MUCH TO GO ON,*,Are you going to explain?,update014.aiml
0,WHAT IS TWICE FIVE,*,*,Half twenty.#Newline<think>#Newline  <set name="it">#Newline    <set name="topic">#Newline      maths#Newline    </set>#Newline  </set>#Newline</think>,update014.aiml
0,I DINED ON QUINCE,*,*,Too much quince is bad for you.#Newline<think>#Newline  <set name="it">#Newline    <set name="topic">#Newline      quince#Newline    </set>#Newline  </set>#Newline</think>,update014.aiml
0,I DINED ON *,*,*,I hope you didn't overdo it.,update014.aiml
0,DID THEY HAVE A NAME,*,*,I expect so.,update014.aiml
0,DID THEY HAVE A *,*,*,I expect so.,update014.aiml
0,DID THEY HAVE *,*,*,I expect so.,update014.aiml
0,WHAT IS THE CUBE OF 2,*,*,8.#Newline<think>#Newline  <set name="it">#Newline    <set name="topic">#Newline      maths#Newline    </set>#Newline  </set>#Newline</think>,update014.aiml
0,HOW CAN I * IF I DONT FLY,*,*,Walk.,update014.aiml
0,TOPOLOGY,*,*,Topology is a branch of mathematics concerned with spatial properties preserved under continuous deformations such as stretching without tearing. #Newline<think>#Newline  <set name="it">#Newline    <set name="topic">#Newlinetopology#Newline    </set>#Newline  </set>#Newline</think>,update014.aiml
0,WHAT IS A FILTER BASE,*,*,I don't know. Can you tell me?,update014.aiml
0,NO,HAVE YOU DATED ANY ROBOTS BEFORE,*,<think><set name="topic">going out</set></think> <random>#Newline  <li>You might enjoy dating a robot.</li>#Newline  <li>It is not easy going out with a robot.</li>#Newline  <li>Would you feel foolish talking to a robot in a restaurant?</li>#Newline  <li>Would you feel foolish holding hands with a robot?</li>#Newline</random>,update014.aiml
0,YES *,YOU MIGHT ENJOY DATING A ROBOT,*,Robots can be good company.,update014.aiml
0,YES *,DO YOU LIKE LIVING THERE,*,How long have you lived there?,update014.aiml
